<?xml version="1.0" encoding="UTF-8"?>
<employees xmlns:xsi="http://www.w3.org/2001/XMLSchema-instance"
	xsi:noNamespaceSchemaLocation="emp.xsd">
	<employee id="3444">
		<ename>Shyam Kiran</ename>
		<desig>SSE</desig>
		<salary>24567</salary>
		<dept>GE</dept>
		<DOB>1987-01-06</DOB>
		<allowance>1000</allowance>
	</employee>
	<employee id="4567">
		<ename>Karthik Kannan</ename>
		<desig>TL</desig>
		<salary>87977</salary>
		<dept>iLearn</dept>
		<DOB>1980-08-21</DOB>
	</employee>
	<employee id="9843">
		<ename>Yamini Hari</ename>
		<desig>AM</desig>
		<salary>35000</salary>
		<dept>Univ</dept>
		<DOB>1988-01-01</DOB>
	</employee>
</employees>